{
  "$schema": "https://json-schema.org/draft/2020-12/schema",
  "$id": "https://faion.net/schemas/autonomous-agents/output.json",
  "title": "Autonomous Agents Output",
  "description": "purpose=schema; consumes=brief+context; produces=artefact; depends-on=01-core-rules.xml; token-budget-impact=low",
  "type": "object",
  "required": ["artefact_id", "owner", "version", "version_stamp", "produced_at", "rationale", "inputs_used"],
  "properties": {
    "artefact_id": {"type": "string", "minLength": 3},
    "owner": {"type": "string", "minLength": 1},
    "version": {"type": "string", "pattern": "^\\d+\\.\\d+\\.\\d+$"},
    "version_stamp": {"type": "string"},
    "produced_at": {"type": "string", "format": "date-time"},
    "fields": {"type": "object"},
    "rationale": {"type": "string", "minLength": 20},
    "inputs_used": {"type": "array", "items": {"type": "string"}, "minItems": 1}
  }
}
