{
  "artefact_id": "ai-incident-postmortem-template-example-001",
  "owner": "alex@faion.net",
  "version": "1.0.0",
  "version_stamp": "ai-incident-postmortem-template@1.0.0",
  "produced_at": "2026-05-22T12:00:00Z",
  "fields": {"placeholder_field": "filled-by-author"},
  "rationale": "Example output for Ai Incident Postmortem Template; references at least one named input.",
  "inputs_used": ["docs/brief.md"]
}
